{
  "$schema": "../references/storyboard.schema.json",
  "version": "2.0",
  "status": "MOTION_PROOF_READY",
  "title": "How Reliable AI Agents Work",
  "summary": "A brush-led ink journey reveals the Context, Action, and Evidence loop for dependable AI work.",
  "aspectRatio": "9:16",
  "width": 720,
  "height": 1280,
  "fps": 30,
  "previewSeconds": 9.2,
  "finalHoldFrames": 36,
  "safeMarginPercent": 8,
  "styleRecipe": "shan-shui-scroll",
  "textMode": "code-native",
  "brushMode": "real-hand-nine-action",
  "realHandProfile": {
    "profile": "gray-linen-xuan",
    "brushAngleRange": [80, 85],
    "armEntry": "lower-right",
    "cropBoundary": "fabric-only",
    "sleeveStyle": "gray-linen",
    "actions": ["hover", "touch", "press", "travel", "turn", "lift", "return", "finish", "leave"],
    "inkPhysics": {
      "paper": "xuan",
      "freshCoreColor": "#2b2722",
      "freshCoreOpacity": 0.92,
      "wetEdgeColor": "#50554d",
      "wetEdgeOpacity": 0.22,
      "dryTrailOpacity": 0.42,
      "dryBrushGapPercent": 20,
      "dryingDelayFrames": 12,
      "diffusionDelayFrames": 5
    }
  },
  "staticArtifact": "assets/static-board.svg",
  "staticArtifactSha256": "60fd20dca67e174064c92b2c496899767cdcf2aa514c83d75eb5032f9fb46861",
  "motionEvidence": {
    "rendererLane": "svg-js",
    "rendererOwner": "Vivi / GoAskVivi",
    "reviewer": "independent visual director",
    "staticApprovalSha256": "60fd20dca67e174064c92b2c496899767cdcf2aa514c83d75eb5032f9fb46861",
    "nineActionProof": "assets/nine-action-proof.png",
    "nineActionProofSha256": "675f845871e860d03fc1aa03098fd3744f94ecac6d58ad5cc49235eb49ca20e4",
    "frames": [
      {"role": "start", "frame": 9, "path": "assets/evidence/start.png", "sha256": "491480d3e7ed75d61bf2002364c3f23a62fa1c1c07486aaa6e3d2a445ccce119"},
      {"role": "middle", "frame": 165, "path": "assets/evidence/middle.png", "sha256": "34c4b683479c7d34688d273d0e2f367fb2c56d8f91199246c14a64168f0374e4"},
      {"role": "end", "frame": 276, "path": "assets/evidence/end.png", "sha256": "80e174d781250b9c569df19c34c477a9341124f8bbfc274613fe158beb80e328"}
    ]
  },
  "beats": [
    {"id": "context", "label": "Context", "copy": "Give the goal, audience, and boundaries.", "startSecond": 2.4, "endSecond": 4.1},
    {"id": "action", "label": "Action", "copy": "Ask for one clear next step.", "startSecond": 4.1, "endSecond": 6.1},
    {"id": "evidence", "label": "Evidence", "copy": "Check the result before calling it done.", "startSecond": 6.1, "endSecond": 7.8}
  ]
}
